<?xml version="1.0" encoding="utf-8"?>
<!DOCTYPE sdocml SYSTEM 
        "http://sdocsml.googlecode.com/dtd/1.0a/sdocml.dtd">

<sdocml>
  <head>
    <defines>
      <!-- Global definitions go here -->
    </defines>
  
    <title>The Title</title>
  </head>
  
  <section>
    <head><title>Introduction</title></head>
    
    Here goes some introductory blabla

    <section>
      <head><title>This is a subsection!</title></head>
      Subsection  text goes here.
    </section> 
  </section> 

  <section>
    <head><title>Another section</title></head>

    And section text
    
    <section url="external-section.xml"/>
  </section>

  <bibliography url="mybibdb.xml"/>
</sdocml>


